Pillar,Energy Level,Challenge #,Challenge Name,Duration,Description,Steps
Stress Reduction,LOW,1,Deep Breathing Anchor,5 minutes,Simple guided breathing to calm your nervous system,Find a comfortable seated position | Place one hand on your chest and one on your belly | Breathe in through your nose for 4 counts | Hold the breath for 4 counts | Exhale through your mouth for 4 counts | Repeat this cycle 10 times | Notice how your body feels
Stress Reduction,LOW,2,Progressive Muscle Relaxation,5 minutes,Release tension by tensing and relaxing muscle groups,"Sit or lie down comfortably | Tense your feet muscles for 3 seconds, then release | Tense your calves for 3 seconds, then release | Continue up through thighs, glutes, abdomen, chest, arms, and face | Notice the contrast between tension and relaxation | Take a deep breath and relax completely | Stay in this relaxed state for 1 minute"
Stress Reduction,LOW,3,Mindful Moment Check-in,5 minutes,Ground yourself in the present moment,Close your eyes or soften your gaze | Notice 5 things you can see around you | Notice 4 things you can physically feel | Notice 3 things you can hear | Notice 2 things you can smell | Notice 1 thing you can taste | Take 3 deep breaths and open your eyes
Stress Reduction,LOW,4,Gentle Neck Release,5 minutes,Release tension from your neck and shoulders,"Sit upright with shoulders relaxed | Slowly tilt your head to the right, hold for 20 seconds | Return to center, then tilt to the left for 20 seconds | Gently roll your shoulders backwards 5 times | Roll your shoulders forwards 5 times | Look over your right shoulder for 20 seconds | Look over your left shoulder for 20 seconds"
Stress Reduction,LOW,5,Gratitude Reflection,5 minutes,Shift focus to positive aspects of your life,"Find a quiet comfortable space | Think of 3 things you're grateful for today | For each item, spend 30-40 seconds reflecting on why you appreciate it | Notice the emotions that arise | Write or mentally note these in your mind | End with a moment of appreciation | Carry this feeling with you"
Stress Reduction,LOW,6,Hand Warming Meditation,5 minutes,Activate relaxation response through gentle hand focus,"Sit comfortably with hands in your lap | Rub your hands together slowly to generate warmth | Place palms on your face, feeling the warmth | Slowly move hands down to your neck | Then to your shoulders | Finally rest hands on your thighs | Stay present with the warmth and relaxation"
Stress Reduction,LOW,7,Belly Breathing Focus,5 minutes,Diaphragmatic breathing for deep relaxation,Lie down on your back with knees bent | Place hands on your belly | Breathe naturally and feel your belly expand on inhale | Feel your belly contract on exhale | Gradually slow down your breathing | Aim for 6-8 breaths per minute | Continue for 5 minutes
Stress Reduction,LOW,8,Tension Release Scan,5 minutes,Identify and release stress points in your body,Close your eyes and mentally scan from head to toe | Notice any areas of tension | Focus on the most tense area | Breathe into that area for 30 seconds | Visualize the tension dissolving | Move to the next tense area | End by taking 3 full body relaxing breaths
Stress Reduction,LOW,9,Soft Gaze Meditation,5 minutes,Calm your mind with a gentle visual focus,"Sit comfortably and choose an object to gaze at | Keep your eyes soft and unfocused | Let your vision become fuzzy and gentle | Notice how this softens your entire nervous system | If thoughts arise, gently return to your soft gaze | Continue for the full 5 minutes | Slowly return to normal vision"
Stress Reduction,LOW,10,Self-Compassion Break,5 minutes,Soothe yourself with kind inner dialogue,Acknowledge that you're experiencing stress | Place your hand over your heart | Repeat softly: 'This is a moment of stress' | Say: 'Suffering is part of life' | Say: 'May I be kind to myself' | Think of a kind phrase and repeat it | Feel the warmth and comfort of your hand
Stress Reduction,LOW,11,Humming Vibration Calm,5 minutes,Use vocal vibrations to activate parasympathetic response,"Sit comfortably with mouth closed | Take a deep breath in through your nose | Hum gently as you exhale, feeling the vibration | Try different pitches and notice the sensations | Continue humming for 5-10 second exhales | Repeat 10-12 times | Notice the calm that follows"
Stress Reduction,LOW,12,Cloud Visualization,5 minutes,Mental imagery to let stress drift away,Sit or lie down and close your eyes | Imagine yourself lying on soft clouds | Visualize your stress as dark clouds passing by | Watch them drift away slowly | Focus on the blue sky and sunshine | Feel safe and supported by your cloud bed | Take a few deep breaths and return
Stress Reduction,LOW,13,Gentle Palm Press,5 minutes,Release tension through palm pressure points,Extend your left arm with palm facing up | Use your right thumb to gently press the center of your palm | Make small circles for 1 minute | Move to different areas of your palm | Repeat on your right hand | Notice the relaxation spreading through your hands | Shake out your hands gently
Stress Reduction,LOW,14,Quiet Mind Pause,5 minutes,Simple stillness without effort,"Find a quiet place and sit comfortably | Don't try to think or not think | Simply be present with what is | Let your eyes be soft or closed | Notice the silence around and within you | If thoughts come, let them pass | Enjoy the peace of stillness"
Stress Reduction,LOW,15,Color Breathing,5 minutes,Associate colors with calming energy,Sit comfortably and close your eyes | Visualize a calming blue light as you inhale | See this blue energy filling your body | Visualize gray stress leaving as you exhale | Watch the gray dissolve into air | Continue alternating for 5 minutes | End surrounded by healing blue light
Stress Reduction,MEDIUM,1,Dynamic Stretching Flow,5 minutes,Move through gentle stretches to release stress,"Stand with feet hip-width apart | Reach arms up and side stretch left, hold 15 seconds | Side stretch right, hold 15 seconds | Forward fold and gently touch your toes, hold 20 seconds | Flow into a gentle backbend, hold 15 seconds | Repeat the sequence 2 more times | End with a full body stretch reaching up"
Stress Reduction,MEDIUM,2,Box Breathing Pattern,5 minutes,Structured breathing for nervous system regulation,Sit upright in a comfortable position | Breathe in through nose for 4 counts | Hold for 4 counts | Exhale through mouth for 4 counts | Hold for 4 counts | Repeat this pattern 15 times | Notice the shift in your nervous system
Stress Reduction,MEDIUM,3,Walking Meditation,5 minutes,Combine movement with mindfulness,"Find a safe walking path indoors or outdoors | Walk slowly and deliberately | Focus on the sensation of each footstep | Notice the rhythm of your walking | Feel the movement in your legs and arms | If your mind wanders, gently bring focus back | Walk for the full 5 minutes"
Stress Reduction,MEDIUM,4,Neck and Shoulder Release,5 minutes,Active release of upper body tension,"Sit upright and relax your shoulders | Slowly roll head clockwise, 5 full rotations | Reverse and roll counterclockwise, 5 rotations | Shrug shoulders up to ears and drop, 10 times | Reach right arm across to left shoulder, feel the stretch for 20 seconds | Repeat on the other side | Gently massage your neck and shoulders"
Stress Reduction,MEDIUM,5,Energy Release Shaking,5 minutes,Use movement to discharge stress energy,"Stand with feet shoulder-width apart | Shake your hands vigorously for 30 seconds | Shake your feet and legs for 30 seconds | Do gentle bouncing while shaking your whole body, 1 minute | Gradually slow down the shaking | Stand still and notice the energy shift | Take 5 deep breaths"
Stress Reduction,MEDIUM,6,Affirmation Practice,5 minutes,Reprogram stress with positive statements,Sit comfortably with eyes closed or soft | Choose an affirmation like 'I am calm and capable' | Repeat it slowly 20-25 times | Sync your affirmation with your breathing | Feel the truth of the statement in your body | Choose another affirmation and repeat | End with your favorite affirmation 5 times
Stress Reduction,MEDIUM,7,Jaw and Face Tension Release,5 minutes,Release stored tension in facial muscles,"Make exaggerated facial expressions - open mouth wide and hold 5 seconds | Scrunch your face tightly and hold 5 seconds | Relax and smile broadly | Use fingertips to massage your temples in circles, 1 minute | Massage your jawline from chin to ears | Gently massage your forehead | Notice the lightness in your face"
Stress Reduction,MEDIUM,8,Nature Visualization,5 minutes,Transport yourself to a peaceful natural setting,"Close your eyes and imagine a peaceful place in nature | Visualize every detail - colors, textures, sounds | Imagine the temperature and air on your skin | Breathe in the fresh air of this place | Feel completely safe and at peace | Spend time exploring this sanctuary | Know you can return anytime"
Stress Reduction,MEDIUM,9,Arm and Leg Extension,5 minutes,Release tension through extended stretching,"Stand or sit with good posture | Extend both arms forward and hold for 15 seconds | Extend them to the sides and hold 15 seconds | Reach arms up and back gently for 15 seconds | In a seated position, extend legs and flex toes for 20 seconds | Point toes away for 20 seconds | Do leg lifts, hold each leg up for 10 seconds"
Stress Reduction,MEDIUM,10,Stress Story Reframe,5 minutes,Change your perspective on stress,Identify a stressful situation you're dealing with | Write or mentally note the facts of the situation | Reframe it as a challenge or opportunity | Think of how you've overcome similar challenges | Identify what strength or skill you'll use | Create a new empowering narrative | Feel the shift in how you perceive the situation
Stress Reduction,MEDIUM,11,Alternating Nostril Breathing,5 minutes,Balance both sides of your nervous system,"Sit comfortably with spine straight | Use your thumb to close your right nostril | Inhale through left nostril for 4 counts | Close left nostril, exhale through right for 4 counts | Inhale through right, exhale through left | Continue alternating for 5 minutes | End with both nostrils, take 3 deep breaths"
Stress Reduction,MEDIUM,12,Tension Tapping,5 minutes,Use tapping to release blocked emotions,"Identify where you hold tension in your body | Gently tap on that area with your fingertips, 10-15 taps | Move to different tension points | Tap on your chest over your heart, 30 seconds | Tap on your upper back, 30 seconds | Increase intensity as feels good | End with gentle stroking on the tapped areas"
Stress Reduction,MEDIUM,13,Power Pose Hold,5 minutes,Use body posture to build confidence and reduce stress,"Stand with feet wide apart, hands on hips | Breathe deeply and hold this powerful pose for 2 minutes | Feel the strength and confidence building | Switch to reaching both arms up overhead, feet grounded | Hold for 2 minutes while breathing deeply | End with hands in prayer position over heart | Notice the calm confidence you've built"
Stress Reduction,MEDIUM,14,Sensory Grounding,5 minutes,Engage all senses to ground in the present,Notice 5 specific things you can see around you | Notice 4 specific things you can physically feel | Notice 3 specific sounds you can hear | Notice 2 specific smells (real or imagined) | Notice 1 specific taste in your mouth | Go through the senses again more slowly | Feel fully present and grounded
Stress Reduction,MEDIUM,15,Loving-Kindness Meditation,5 minutes,Cultivate compassion to dissolve stress,"Sit comfortably and bring yourself to mind | Say 'May I be happy, healthy, and at peace' 5 times | Bring someone you love to mind and repeat for them | Bring a neutral person to mind and repeat | Bring someone difficult to mind and repeat with compassion | Extend wishes to all beings | Feel the warmth and openness in your heart"
Stress Reduction,HIGH,1,Fast-Paced Breathwork,5 minutes,Activate parasympathetic response through dynamic breathing,"Stand with feet grounded, knees slightly bent | Practice Breath of Fire: rapid belly breathing, 10 seconds | Return to normal breathing for 20 seconds | Repeat the rapid breathing pattern 5 times | Transition to slow, deep breathing, 1 minute | Notice the dramatic shift in your energy | End with 5 minutes of steady, calm breathing"
Stress Reduction,HIGH,2,Vigorous Movement Release,5 minutes,Burn off stress energy through intense movement,"Stand in open space with room to move | Do jumping jacks for 45 seconds at full intensity | Do high knees in place for 45 seconds | Do burpees (squat, jump, land) for 45 seconds | Dance freely and wildly for 1 minute | Gradually slow down over 30 seconds | End with deep breathing and grounding"
Stress Reduction,HIGH,3,Stress Purging Scream,5 minutes,Release tension through vocalization,"Find a private place where you can make noise | Take a deep breath and release with a loud, primal scream | Let all tension out through your voice | Repeat 5-10 times with full force | Transition to making other vocal sounds - roaring, growling | Gradually soften your sounds | End with humming and deep breathing"
Stress Reduction,HIGH,4,High-Intensity Interval Breathing,5 minutes,Combine movement and structured breathing,"Do 30 seconds of jumping jacks while breathing normally | Stop and do 30 seconds of slow, deep breathing | Do 30 seconds of running in place while panting forcefully | Stop and do 30 seconds of recovery breathing | Do 30 seconds of mountain climbers | Stop and breathe deeply for 1 minute | Repeat the cycle once more"
Stress Reduction,HIGH,5,Aggressive Visualization,5 minutes,Mentally release stress through powerful imagery,"Visualize your stress as a color or object | Imagine yourself hitting, destroying, or dissolving it | Use all your mental energy to visualize complete destruction | Watch it transform into light and dissolve | Visualize yourself standing victorious and powerful | Feel the sense of relief and control | Return to normal consciousness"
Stress Reduction,HIGH,6,Cold Water Shock,5 minutes,Use cold water to reset your nervous system,"Run cold water on your wrists for 30 seconds | Splash cold water on your face, gasping intentionally | Plunge hands in cold water for 1 minute | Practice controlled breathing through the cold sensation | Notice the activation and then calming of your nervous system | Gradually warm your hands and face with warm water | Notice the contrast and relaxation response"
Stress Reduction,HIGH,7,Intense Stretching Circuit,5 minutes,Push beyond comfort zone with deep stretches,"Do a deep forward fold, reaching for toes, hold 45 seconds | Do a deep lunge on each side, 45 seconds each | Do a deep twist, pulling your torso, 45 seconds each side | Do a deep backbend, 45 seconds | Do a deep pigeon pose or hip opener, 45 seconds each side | Return to forward fold and breathe deeply | Gradually ease out of stretches"
Stress Reduction,HIGH,8,Power Walking Meditation,5 minutes,Fast-paced mindful movement,"Walk at a brisk pace, maintaining awareness | Feel each powerful step on the ground | Sync your breathing with your steps | Feel the strength in your legs and core | Channel any angry or intense emotion into your walk | Gradually slow your pace over the last minute | Return to normal state with controlled breathing"
Stress Reduction,HIGH,9,Intense Core Work,5 minutes,Build strength and release tension simultaneously,"Do 45 seconds of planks, holding strong position | Do 45 seconds of side planks (each side) | Do 45 seconds of high knees or running in place | Do 45 seconds of mountain climbers | Rest for 30 seconds with controlled breathing | Repeat the sequence once more | Shake out your body and breathe deeply"
Stress Reduction,HIGH,10,Rapid-Fire Affirmations,5 minutes,Build momentum with powerful statements,"Stand with energy and power in your stance | Rapid-fire speak affirmations: 'I am strong, I am capable, I am resilient' | Increase the intensity and speed of your delivery | Add physical gestures - pointing, fist pumping | Transition to slower, more intentional affirmations | Feel the power you've built within you | Take 3 deep, grounding breaths"
Stress Reduction,HIGH,11,Intense Yoga Flow,5 minutes,Dynamic flow that channels stress into movement,"Sun salutation A, flowing quickly, 1.5 minutes | Warrior poses (I, II, III) on each side, 1.5 minutes | Transition to downward dog and push-ups, 1 minute | Hold plank pose for 30 seconds | Return to child's pose for final 30 seconds of breathing | Slowly rise and feel the shift in your energy | Notice the calm after the intensity"
Stress Reduction,HIGH,12,Resistance Band Stress Release,5 minutes,Channel tension into strength building,"Use a resistance band or rope | Do bicep curls with intensity, 30 seconds | Do overhead presses with force, 30 seconds | Do lateral band walks with power, 30 seconds | Do band rows explosively, 30 seconds | Rest and breathe, 1 minute | Repeat the circuit at slightly reduced intensity"
Stress Reduction,HIGH,13,Punching Bag Release,5 minutes,Physically release stress through punching,"Stand in front of a punching bag or pillow | Punch with controlled intensity for 1 minute | Vary punch combinations - jabs, crosses, hooks | Increase intensity for 30 seconds at full power | Slow down your punches over next minute | Return to normal breathing and pace | Notice the release of pent-up energy"
Stress Reduction,HIGH,14,Explosive Movement Circuit,5 minutes,High-intensity bursts to discharge stress,Do 30 seconds of burpees at maximum intensity | Rest 15 seconds | Do 30 seconds of box jumps or jumping lunges | Rest 15 seconds | Do 30 seconds of jump rope or high knees | Rest for 1 minute with deep breathing | Do one final 30-second max effort round
Stress Reduction,HIGH,15,Warrior Mind Meditation,5 minutes,Build mental strength to face stress,"Sit in powerful, upright posture | Visualize yourself as a warrior facing challenges | Feel the strength and courage within you | Repeat: 'I face my challenges with courage and strength' | Visualize yourself overcoming obstacles | Feel the warrior energy throughout your body | Rise from meditation with renewed confidence"
Increased Energy,LOW,1,Gentle Morning Stretch,5 minutes,Gradually awaken your body with light stretching,"Sit or lie down and take 5 deep breaths | Gently reach your arms overhead and stretch | Roll your neck slowly, 5 times each direction | Reach toward your toes gently | Rotate your torso slowly, 5 times each side | Circle your shoulders backward 5 times | Stand slowly and feel the gentle awakening"
Increased Energy,LOW,2,Slow Walk Activation,5 minutes,Gentle movement to get blood flowing,"Start with very slow, deliberate walking | Gradually increase pace over 1 minute | Swing your arms gently with each step | Focus on deep, rhythmic breathing | Walk for 3 minutes at a comfortable pace | Gradually slow down over the last minute | Notice the awakening throughout your body"
Increased Energy,LOW,3,Hydration & Breathing Ritual,5 minutes,Rehydrate and energize through breath,"Drink a glass of water slowly over 1 minute | Stand with feet shoulder-width apart | Take 10 deep cleansing breaths, emphasizing exhales | Feel the water and oxygen energizing your cells | Shake your hands and feet gently | Feel the tingling sensation of activation | Notice your energy level rising"
Increased Energy,LOW,4,Gentle Arm Circles,5 minutes,Build energy through arm movement,"Stand with feet shoulder-width apart | Make small circles with your arms forward, 1 minute | Make small circles with your arms backward, 1 minute | Gradually increase the size of circles | Do large circles forward for 1 minute | Do large circles backward for 1 minute | End with arms stretched out and take deep breaths"
Increased Energy,LOW,5,Positive Affirmation Boost,5 minutes,Mental energy lift with positive thoughts,"Sit comfortably with good posture | Choose an energizing affirmation like 'I am full of energy' | Repeat it slowly 15 times | With each repetition, feel the energy building | Choose another affirmation and repeat 15 times | Stand and repeat a final affirmation 10 times | Feel the mental energy shift within you"
Increased Energy,LOW,6,Sunlight Exposure Ritual,5 minutes,Natural light to activate circadian rhythm,Go outside or stand near a window | Let sunlight hit your face for 1-2 minutes | Blink naturally and soak in the light | Take deep breaths of fresh air | Notice the natural energizing effect | Do gentle stretches in the sunlight | End by feeling naturally more awake
Increased Energy,LOW,7,Seated Spinal Twist,5 minutes,Gentle twists to energize your spine,"Sit upright with legs extended | Bend your right knee and place foot outside left knee | Slowly twist to the right, hold for 30 seconds | Release and return to center | Repeat on the left side for 30 seconds | Do 3 rounds of this gentle twisting | Notice the energizing sensation through your spine"
Increased Energy,LOW,8,Toe Touch Awakening,5 minutes,Forward bend with finger taps to energize,"Stand with feet hip-width apart | Slowly fold forward, letting arms hang | Gently tap the top of your head, 20 times | Slowly tap down your spine toward lower back | Let your body hang loose for 30 seconds | Slowly roll up vertebra by vertebra | Feel the energy rush from inversion"
Increased Energy,LOW,9,Subtle Movement Flow,5 minutes,Slow flowing movements to build energy,"Stand with feet together | Slowly raise arms to sides and up overhead, take 5 seconds | Slowly lower arms back down, take 5 seconds | Repeat this movement 10 times | Add a gentle sway side to side | Gradually increase the fluidity | Feel the graceful energy building"
Increased Energy,LOW,10,Mindful Morning Sip,5 minutes,Awakening ritual with warm beverage,"Prepare a warm beverage (tea, coffee, or warm water) | Sit comfortably and hold the warm cup | Feel the warmth in your hands | Smell the aroma deeply, 5 times | Take small, intentional sips | Notice the warmth spreading through your body | Feel naturally energized and ready"
Increased Energy,LOW,11,Shoulder Shrug Release,5 minutes,Release stiffness and activate shoulders,"Sit or stand with good posture | Slowly shrug shoulders up to ears, hold 3 seconds | Release and drop shoulders down | Repeat 20 times slowly and intentionally | Add a gentle roll at the bottom of each shrug | Gradually increase the range and speed | Feel the energy and ease in your shoulders"
Increased Energy,LOW,12,Cross-Body Reach,5 minutes,Gentle stretching to awaken muscles,"Stand with feet hip-width apart | Reach right arm across your body to left side | Gently pull with left hand, hold 30 seconds | Release and reach left arm across | Gently pull with right hand, hold 30 seconds | Repeat this sequence 3 more times | Notice the awakening through your chest and arms"
Increased Energy,LOW,13,Seated Head Movements,5 minutes,Gentle neck movements to awaken,"Sit upright with good posture | Slowly turn your head left, hold 20 seconds | Return to center and turn right, hold 20 seconds | Slowly tilt head left, hold 20 seconds | Tilt head right, hold 20 seconds | Do gentle forward and backward tilts | Feel the awakening through your entire head and neck"
Increased Energy,LOW,14,Gentle Bouncing,5 minutes,Light movement to activate circulation,Stand with feet shoulder-width apart | Gently bounce up and down on the balls of your feet | Keep movement subtle and rhythmic | Add gentle arm swings with the bouncing | Continue for 3 minutes | Gradually reduce bouncing speed | Stand still and feel the circulation activation
Increased Energy,LOW,15,Energy Visualization,5 minutes,Mental imagery for energy boost,"Sit or lie comfortably | Visualize bright, golden energy entering through the top of your head | See this energy flowing through your entire body | Watch it fill you with light and vitality | Feel the energy strengthening every cell | Spend 1 minute in this energized state | Open eyes feeling refreshed and energized"
Increased Energy,MEDIUM,1,Dynamic Cardio Burst,5 minutes,Moderate-intensity cardio for sustained energy,Do 1 minute of jogging in place at moderate pace | Do 30 seconds of high knees | Do 30 seconds of high-energy marching | Do 1 minute of jumping jacks at steady pace | Do 30 seconds of butt kicks | Do 1 minute of jogging in place | End with 30 seconds of controlled breathing
Increased Energy,MEDIUM,2,Energizing Yoga Flow,5 minutes,Flowing poses for mental and physical energy,"Do 5 sun salutation A flows, moderate pace | Hold warrior pose I on each side, 20 seconds | Do warrior pose II on each side, 20 seconds | Do mountain pose with arms overhead, 20 seconds | Flow into child's pose and rest for 30 seconds | Return to standing with arms raised | Feel the energy surge through your body"
Increased Energy,MEDIUM,3,Staircase Circuit,5 minutes,Build energy through resistance movement,Do 45 seconds of step-ups (use stairs or bench) | Rest 15 seconds | Do 45 seconds of walking lunges | Rest 15 seconds | Do 45 seconds of squat pulses | Rest 15 seconds | Do final 45 seconds combining all movements
Increased Energy,MEDIUM,4,Uplifting Music Dance,5 minutes,Dance to your favorite energetic music,Put on your favorite uplifting song | Dance freely for the first 2 minutes | Gradually increase intensity and movement | Engage your whole body in the dance | Use larger movements and higher energy | Gradually wind down in the final 1 minute | Feel the natural energy boost from movement and music
Increased Energy,MEDIUM,5,Breathing Energizer,5 minutes,Structured breathing to increase alertness,"Sit upright with good posture | Do 20 rounds of Breath of Fire (rapid belly breathing) | Return to normal breathing for 20 seconds | Take 10 deep, energizing breaths | Repeat the rapid breathing pattern 20 times | End with 20 seconds of normal breathing | Notice the mental clarity and energy boost"
