Pillar,Energy Level,Challenge #,Challenge Name,Duration,Description,Steps
Increased Energy,MEDIUM,6,Power Jump Session,5 minutes,High-energy jumping to activate muscles,Do 45 seconds of jump rope or jumping in place | Rest 15 seconds with light bouncing | Do 45 seconds of split jumps or alternating leg jumps | Rest 15 seconds | Do 45 seconds of double jumps | Rest 15 seconds | Do final 45 seconds at maximum comfortable intensity
Increased Energy,MEDIUM,7,Invigorating Cold Shower,5 minutes,Cold water activation for instant energy,"Start with warm water, gradually turn temperature cool | Let cool water run on your arms and legs first | Gradually move to cooler temperatures | Splash face with cool water, take controlled breaths | End with 30 seconds of warm water to balance | Dry off and notice the immediate energy boost | Feel alert and invigorated"
Increased Energy,MEDIUM,8,Power Stance Energy,5 minutes,Use power poses to build confidence and energy,"Stand with feet wide, hands on hips, 1 minute | Switch to standing with arms raised above head, 1 minute | Do power jumps with arms raised, 1 minute | Return to hands on hips stance, 1 minute | Add vocal affirmations like 'I am powerful and energized' | Feel the surge of energy and confidence | Maintain this powerful posture"
Increased Energy,MEDIUM,9,Speed Walking Meditation,5 minutes,Brisk mindful walking with energy building,"Walk at a brisk pace, faster than normal | Feel your heartbeat increasing | Sync your breathing with your pace | Pump your arms in rhythm with walking | Maintain this pace for 3 minutes | Gradually slow to normal pace in final 2 minutes | Notice the sustained energy boost"
Increased Energy,MEDIUM,10,Energizing Mantra,5 minutes,Powerful affirmations to boost mental energy,Stand with confident posture | Choose an energizing mantra like 'I am strong and capable' | Repeat it 25 times with increasing intensity | Add physical movements like fist pumping | Choose another empowering mantra | Repeat it 25 times with full conviction | Feel the mental energy and confidence surge
Increased Energy,MEDIUM,11,Interval Training Sprint,5 minutes,Alternating high and moderate intensity,"Do 30 seconds of slow, easy movement | Burst into 30 seconds of high-intensity movement | Return to 30 seconds of easy movement | Repeat this pattern for the full 5 minutes | Make sure to have at least 4 bursts of high intensity | End with 30 seconds of easy movement | Notice the energized state your body is in"
Increased Energy,MEDIUM,12,Tension Release & Energy Flow,5 minutes,Release blockages and restore energy flow,Do 1 minute of shaking your whole body | Do 1 minute of dynamic stretching movements | Do 1 minute of flowing movements like tai chi | Do 1 minute of power movements like punching | Do 1 minute of deep breathing and energy visualization | Feel the free flow of energy through your body | Stand with arms raised and feel the vitality
Increased Energy,MEDIUM,13,Moderate-Paced Cycling,5 minutes,Stationary bike for consistent energy boost,Start pedaling at an easy pace for 1 minute | Increase to moderate pace for 2 minutes | Increase resistance slightly and maintain for 1 minute | Return to easy pace for final 1 minute | Feel your heart rate and energy increasing | Notice improved circulation and alertness | Cool down with calm breathing
Increased Energy,MEDIUM,14,Team Sport Energy,5 minutes,Quick game session for social energy boost,Find a partner for a quick game like ping pong or badminton | Play with moderate-to-high energy for 4 minutes | Focus on fun and engagement rather than winning | Use quick movements and strategic thinking | Rest for 1 minute at the end | Feel the boost from social interaction and movement | Notice sustained energy from engagement
Increased Energy,MEDIUM,15,Gratitude Energy Shift,5 minutes,Shift mental state to boost energy through gratitude,"Stand with good posture and smile gently | Think of 3 things you're grateful for | For each, spend 1 minute reflecting on the gratitude | Feel the shift in your emotional state | Notice how gratitude creates natural energy | Take 3 deep breaths with this elevated state | Carry this energy forward into your day"
Increased Energy,HIGH,1,HIIT Workout Extreme,5 minutes,High-intensity interval training for maximum energy,Do 40 seconds of burpees at maximum intensity | Rest 20 seconds with controlled breathing | Do 40 seconds of jump squats at full power | Rest 20 seconds | Do 40 seconds of mountain climbers at maximum speed | Rest 20 seconds | Do final 40 seconds combining all movements at full intensity
Increased Energy,HIGH,2,Intense Circuit Training,5 minutes,Back-to-back high-intensity exercises,Do 30 seconds of push-ups at maximum pace | Do 30 seconds of high knees running in place | Do 30 seconds of sit-ups or crunches | Do 30 seconds of jump lunges | Do 30 seconds of plank hold with tremors | Do 30 seconds of box jumps or vertical jumps | Do final 30 seconds of the most challenging exercise
Increased Energy,HIGH,3,Sprint Intervals,5 minutes,All-out sprinting for maximum cardiovascular boost,"Do 30 seconds of sprinting at full speed | Walk and recover for 20 seconds with deep breathing | Repeat the sprint-recovery pattern 6 more times | On the final sprint, push at absolute maximum effort | Walk and recover for 1 minute with controlled breathing | Feel the massive energy surge and elevated heart rate | Take deep breaths to integrate the energy"
Increased Energy,HIGH,4,Combat Sport Simulation,5 minutes,High-energy martial arts movements,Do 1 minute of fast punching combinations | Do 1 minute of fast kicking combinations | Do 1 minute of defensive movements and dodging | Do 1 minute of aggressive striking at maximum speed | Do final 1 minute combining all movements | Notice the warrior energy awakening | Feel primed and powerful
Increased Energy,HIGH,5,Plyometric Power Circuit,5 minutes,Explosive jumping movements for peak energy,Do 45 seconds of box jumps at full power | Rest 15 seconds | Do 45 seconds of clapping push-ups explosively | Rest 15 seconds | Do 45 seconds of explosive lunges | Rest 15 seconds | Do final 45 seconds of maximum intensity jumping
Increased Energy,HIGH,6,Full-Body Power Activation,5 minutes,Rapid-fire movements engaging entire body,"Stand with feet shoulder-width apart | Rapid arm circles while doing squats, 45 seconds | Jumping jacks combined with arm punches, 45 seconds | Burpees with speed and power, 45 seconds | Mountain climbers at maximum speed, 45 seconds | Dead lift movements with explosive power, 45 seconds | Final 30 seconds: choose your most energizing movement"
Increased Energy,HIGH,7,Aggressive Affirmation Power,5 minutes,High-energy affirmations with intense movement,"Stand in power stance and shout affirmations rapidly | Combine with powerful arm movements and jumps | Repeat: 'I am unstoppable, I am powerful, I am ready' 50+ times | Increase volume and intensity of your voice | Add aggressive gestures and movements | Build to a crescendo of energy and power | Take a final victory stance with raised arms"
Increased Energy,HIGH,8,Speed Rope Training,5 minutes,Ultra-fast jump rope for maximum energy,Do 1 minute of fast jump rope at sustainable pace | Do 30 seconds of double-unders (rope passes twice per jump) | Do 1 minute of regular speed again | Do 30 seconds of highest possible speed sprinting | Do 1 minute at challenging but sustainable pace | End with final 30 seconds at maximum intensity | Notice the extreme energy activation
Increased Energy,HIGH,9,Strongman Movements,5 minutes,Power-based movements for explosive energy,Do 45 seconds of heavy deadlift movements | Do 45 seconds of explosive tire flips or equivalent | Do 45 seconds of farmer's carry walking with intensity | Do 45 seconds of overhead press movements with power | Do 45 seconds of pushing movements against resistance | Do final 45 seconds combining all movements | Feel the primal power energy flowing
Increased Energy,HIGH,10,Extreme Energy Breathing,5 minutes,Intense pranayama for maximum mental activation,"Do 30 rounds of Breath of Fire (rapid belly breathing) | Take 5 normal breaths to recover | Do 30 more rounds of rapid breathing | Take 5 normal breaths | Do final 30 rounds at maximum intensity | Take deep, grounding breaths for 30 seconds | Notice the extreme mental clarity and energy"
Increased Energy,HIGH,11,Competitive Sport Burst,5 minutes,High-intensity competitive activity,"Engage in a competitive sport at full intensity for 5 minutes | Examples: basketball, soccer, tennis, racquetball | Push yourself at maximum competitive level | Use strategic thinking combined with physical intensity | Feed off the competitive energy | Notice the natural adrenaline surge | Feel the extreme activation and power"
Increased Energy,HIGH,12,Extreme Resistance Training,5 minutes,Heavy lifting movements for power energy,"Use weights or resistance at challenging level | Do compound movements: squats, deadlifts, presses | Do 45 seconds maximum effort on each movement | Rest 15 seconds between movements | Complete 5 different compound movements | Final 30 seconds: all-out effort on your strongest movement | Feel the explosive power generated"
Increased Energy,HIGH,13,Parkour Energy Flow,5 minutes,Dynamic movement overcoming obstacles,"Find a safe area with obstacles (stairs, benches, etc.) | Jump, climb, and move over obstacles for full 5 minutes | Maintain high intensity and creativity | Challenge yourself with difficult movements | Flow from one obstacle to the next | Push your physical capabilities | Feel the adrenaline and peak energy"
Increased Energy,HIGH,14,Intense Music Power Dance,5 minutes,Maximum-intensity dance to uplifting music,"Choose the most energetic music you love | Dance with explosive movements for full 5 minutes | Engage your entire body with power | Make large, forceful movements | Increase intensity throughout the session | Let the music fuel your movement | Feel unstoppable energy and freedom"
Increased Energy,HIGH,15,Victory Mindset Activation,5 minutes,Mental preparation for peak performance,"Stand in a powerful stance with chest open | Visualize yourself achieving a major goal | Feel the victory and accomplishment | Repeat victory affirmations loudly and powerfully | Do power movements that match the feeling | Punch the air, jump, and express the victory feeling | Emerge with unstoppable confidence and energy"
Better Sleep,LOW,1,Progressive Body Relaxation,5 minutes,Systematic muscle relaxation for sleep preparation,"Lie in bed or on a comfortable surface | Starting from your feet, tense muscles for 3 seconds | Release and notice the relaxation | Progress slowly upward: calves, thighs, glutes, abs | Continue through chest, arms, and head | End with facial muscles completely relaxed | Drift into deep relaxation and sleep"
Better Sleep,LOW,2,Gentle Bedtime Stretch,5 minutes,Light stretching to prepare body for sleep,"Lie in bed with legs extended | Gently point and flex your toes, 10 times | Hug knees to chest and hold for 20 seconds | Spinal twist: pull right knee across body, hold 20 seconds | Repeat on left side for 20 seconds | Extend both legs and do final relaxation stretch | Settle into sleep-ready position"
Better Sleep,LOW,3,Sleep Breathing Pattern,5 minutes,Calming breathing to induce sleep,Lie comfortably in bed | Inhale slowly through nose for 4 counts | Hold briefly for 2 counts | Exhale slowly through mouth for 6 counts | Pause for 2 counts | Repeat this pattern 10-15 times | Allow yourself to drift into sleep
Better Sleep,LOW,4,Guided Body Scan,5 minutes,Systematic awareness moving toward sleep,"Lie comfortably in bed with eyes closed | Mentally scan from your toes upward | Release any tension with each area you pass | Spend 20-30 seconds on each body section | Move slowly: feet, legs, torso, arms, head | End by visualizing your whole body relaxed | Allow sleep to come naturally"
Better Sleep,LOW,5,Sleep Affirmations,5 minutes,Positive statements to prepare mind for sleep,"Lie in bed and take 3 deep breaths | Repeat silently: 'I am ready for deep, restorative sleep' | Repeat 10 times slowly and deliberately | Add: 'My body is heavy and relaxed' | Repeat this 10 times | Finish with: 'I am drifting into peaceful sleep' | Let yourself drift off"
Better Sleep,LOW,6,Warm Bath Ritual,5 minutes,Temperature transition for sleep readiness,"Run a warm bath before bed | Soak for 5 minutes in warm water | Feel the warmth relaxing your muscles | Take slow, deep breaths | Allow your body temperature to rise | Exit the bath and cool down naturally | This temperature drop triggers sleep response"
Better Sleep,LOW,7,Gentle Neck & Shoulder Release,5 minutes,Release upper body tension before sleep,"Sit upright at edge of bed or in chair | Slowly roll shoulders backward, 5 times | Slowly roll shoulders forward, 5 times | Gently tilt head left, hold 20 seconds | Tilt head right, hold 20 seconds | Look over each shoulder slowly | Lie back and feel completely relaxed"
Better Sleep,LOW,8,White Noise Focus,5 minutes,Use sound to quiet the mind,"Play gentle white noise, rainfall, or ocean sounds | Lie in bed and focus your attention on the sound | Let the sound occupy your mental space | Don't try to sleep, just listen | Allow thoughts to drift away naturally | Feel your body becoming heavier | Drift off listening to the soothing sound"
Better Sleep,LOW,9,Counting Down Visualization,5 minutes,Mental focus technique for sleep onset,"Lie in bed and close your eyes | Visualize the number 10 clearly in your mind | See it fading slowly as you mentally say 'relax' | Move to 9, 8, 7, continuing downward | Spend about 20-30 seconds on each number | By number 1, allow yourself to drift into sleep | Don't force, just let it happen naturally"
Better Sleep,LOW,10,Peaceful Place Journey,5 minutes,Mental travel to relaxing location,"Visualize a peaceful place you find relaxing | Beach, forest, mountains, or anywhere calming | Engage all senses in this visualization | Feel the air, see the colors, hear the sounds | Spend time peacefully in this place | Feel completely safe and relaxed | Allow this peaceful feeling to guide you to sleep"
Better Sleep,LOW,11,Lavender Aromatherapy,5 minutes,Use scent to prepare for sleep,Place lavender essential oil or lavender sachet near your bed | Lie down and breathe in the calming scent | Focus on how the scent makes you feel | Breathe deeply and let the aroma calm you | Continue for 5 minutes | The calming scent will support sleep onset | Turn off lights and drift off
Better Sleep,LOW,12,Leg Elevation Relaxation,5 minutes,Comfortable positioning to aid sleep,"Lie on back with legs elevated on a pillow | This position reduces physical tension | Focus on the comfort of this position | Take slow, deep breaths | Let your body settle into the mattress | Feel heaviness spreading through your body | Maintain this comfortable position for sleep"
Better Sleep,LOW,13,Mindful Muscle Awareness,5 minutes,Gentle attention to physical sensations,"Lie in bed and focus on one body part at a time | Notice any sensations without judgment | Mentally acknowledge: 'My feet are relaxed' | Move through each body part this way | Speak silently to each area with appreciation | By the end, your body will feel completely relaxed | Drift into sleep naturally"
Better Sleep,LOW,14,Gentle Back Rub,5 minutes,Self-massage to aid relaxation and sleep,"Lie on your side or have someone gently rub your back | Use slow, gentle strokes from shoulders to lower back | Focus on relaxing each muscle as you touch it | Include circular motions on tight areas | Continue for full 5 minutes | Notice the deep relaxation spreading | Lie in this relaxed state and sleep"
Better Sleep,LOW,15,Twilight Hour Meditation,5 minutes,Meditation in the space between wake and sleep,"Lie comfortably as day turns to night | Don't try to meditate, simply observe | Watch thoughts arise and pass naturally | Don't engage with the thoughts | Remain in this twilight state of awareness | Allow consciousness to gradually fade | Transition naturally into sleep"
Better Sleep,MEDIUM,1,Active Relaxation Flow,5 minutes,Gentle movement followed by deep relaxation,"Do very light stretching for 2 minutes | Gentle forward folds, side stretches, twists | Transition to floor and assume reclined position | Use Progressive Muscle Relaxation for remaining 3 minutes | Systematically relax each muscle group | Feel the transition from movement to stillness | Remain in relaxed state as you sleep"
Better Sleep,MEDIUM,2,Evening Yoga Flow,5 minutes,Calming yoga poses for sleep preparation,"Start in child's pose for 30 seconds | Move into cat-cow pose, 30 seconds | Thread-the-needle pose each side, 45 seconds | Supported bridge pose, 45 seconds | Legs-up-the-wall pose, 2 minutes | Return to child's pose | Lie flat for final rest"
Better Sleep,MEDIUM,3,Narrative Sleep Story,5 minutes,Mental storytelling to guide toward sleep,"Lie in bed and create a boring mental story | Make it repetitive, peaceful, and uneventful | Example: describing a long walk through nature | Include sensory details to engage your mind fully | As the story progresses, mentally become sleepy | The mind grows tired of the story | Allow sleep to come as you stop narrating"
Better Sleep,MEDIUM,4,4-7-8 Breathing Technique,5 minutes,Medical breathing technique specifically for sleep,"Lie in bed and close your eyes | Inhale through nose for 4 counts | Hold breath for 7 counts | Exhale through mouth for 8 counts | Repeat this pattern 8 times | By the end, significant drowsiness will occur | Maintain this pattern and drift to sleep"
Better Sleep,MEDIUM,5,Chakra Balancing Meditation,5 minutes,Energy center balancing for sleep wellness,"Lie down and visualize a red light at your root | Visualize it transforming to calming colors: orange, yellow, green | Continue upward: blue at throat, indigo at third eye, violet at crown | Each color brings deeper relaxation | Hold on the violet light at the crown | Feel deeply balanced and ready for sleep | Drift off in this balanced state"
Better Sleep,MEDIUM,6,Cognitive Shuffle,5 minutes,Random mental imagery to stop racing thoughts,"Lie in bed and think of random objects | Don't create stories, just random images | Visualize: a shoe, then a tree, then a book, etc. | Switch images every 3-5 seconds | The random nature prevents meaningful thought | Your mind gradually becomes too tired to continue | Sleep naturally follows"
Better Sleep,MEDIUM,7,Timed Gratitude Practice,5 minutes,Gratitude meditation transitioning to sleep,"Lie in bed and think of 10 things you're grateful for | Spend about 20-30 seconds on each | Really feel the gratitude and appreciation | Notice how gratitude brings peace | By the end, your mind is calm and settled | Your heart is open and peaceful | Drift off in this peaceful gratitude state"
Better Sleep,MEDIUM,8,Progressive Heaviness Induction,5 minutes,Autogenic suggestion for sleep induction,"Lie comfortably and repeat: 'My feet are heavy and warm' | Move upward through body: 'My legs are heavy,' etc. | Spend about 30 seconds on each suggestion | By the time you reach your head, your body feels heavy | The heaviness pulls you toward sleep | Continue suggesting heaviness | Let yourself sink into sleep"
Better Sleep,MEDIUM,9,Gentle Humming Sound,5 minutes,Soothing vibrations for sleep onset,Lie comfortably in bed | Take a deep breath and hum gently as you exhale | The vibration is soothing and calming | Continue for about 5-10 second exhales | The vibration creates relaxation waves | Gradually slow the humming down | Stop and notice the peaceful silence
Better Sleep,MEDIUM,10,Temperature Awareness Practice,5 minutes,Body temperature perception for sleep prep,"Lie under your blankets and focus on temperature | Notice how the blanket warms your body | Feel the increasing comfort and coziness | This triggers the body's natural sleep response | Breathing naturally slows and deepens | Feel completely warm, safe, and ready for sleep | Allow sleep to come naturally"
Better Sleep,MEDIUM,11,Hypnagogic Visualization,5 minutes,Guided journey through hypnagogic state,"Lie in bed and visualize descending stairs | You're going deeper with each step | Imagine each step takes you deeper into relaxation | By 10 steps, you're very deep and relaxed | Continue down a long hallway | Each step brings you closer to sleep | Allow yourself to drift off"
Better Sleep,MEDIUM,12,Bilateral Stimulation Relaxation,5 minutes,Alternate side awareness for balance and sleep,Lie down and focus on your left side | Feel the left side becoming heavy and relaxed | Switch focus to your right side | Feel the right side becoming heavy and relaxed | Continue alternating every 20-30 seconds | The bilateral awareness creates balance | Sleep comes more easily in this balanced state
Better Sleep,MEDIUM,13,Mantra Repetition Sleep,5 minutes,Repetitive mental phrase for sleep onset,"Choose a simple mantra: 'Sleep, peace, rest' | Repeat it slowly and continuously | Sync with your breathing pattern | Don't force, let it flow naturally | The repetition occupies your mind | Thoughts gradually fade | Sleep takes over"
Better Sleep,MEDIUM,14,Weighted Blanket Simulation,5 minutes,Deep pressure simulation without weighted blanket,Lie under regular blankets or use a few extra layers | Let the weight settle on your body | Feel the gentle pressure | Deep pressure triggers the parasympathetic response | Your body naturally prepares for sleep | Continue focusing on the pressure sensation | Drift off feeling secure and held
Better Sleep,MEDIUM,15,Sleep Onset Alert Technique,5 minutes,Paradoxical technique using intention reversal,Lie in bed and tell yourself: 'I will stay awake' | Try to keep your eyes open | The paradox works: your body wants to sleep | Your eyelids become heavy despite your intention | Your mind grows foggy | Fighting sleep often leads to faster sleep onset | Stop resisting and drift off
Better Sleep,HIGH,1,Intense Evening Workout,5 minutes,High-intensity exercise early evening to prepare for sleep,"Do 1 minute of burpees or high-intensity cardio | Do 1 minute of strength movements | Do 1 minute of intense cardio bursts | Do 1 minute of full-body movements | Do final 1 minute at maximum intensity | The exhaustion will make sleep much easier | By bedtime, your body will desperately need sleep"
Better Sleep,HIGH,2,Sauna & Cold Plunge Protocol,5 minutes,Temperature extremes followed by deep sleep,"Spend 2-3 minutes in a hot sauna (optional: or hot shower) | This raises your core body temperature | Exit and cool down naturally in room temperature | The body's natural cooling triggers deep sleep | Your body is primed for maximum sleep recovery | Go to bed immediately after cooling | Expect very deep, restorative sleep"
Better Sleep,HIGH,3,Strenuous Hike or Run,5 minutes,Physical exhaustion for powerful sleep onset,Do a 5-minute intense run or trail hike | Push yourself to breathlessness | Challenge your body physically | The extreme physical fatigue will trigger deep sleep | Your body will demand recovery | Sleep will be immediate and deep | Experience highly restorative sleep
Better Sleep,HIGH,4,Aggressive Nervous System Release,5 minutes,Release trapped stress for deep sleep,"Do intense shaking and tremoring movements | Release all pent-up stress and tension | Shake your entire body with force | Allow emotional release if it comes | By the end, you'll feel liberated | This deep release prepares you for deep sleep | Sleep will feel like a welcomed refuge"
Better Sleep,HIGH,5,Extreme Cold Adaptation,5 minutes,Cold exposure to trigger deep sleep response,"Take a very cold shower (as cold as you can tolerate) | This creates stress on the system | As you warm up afterward, sleep response kicks in | The body seeks recovery | Warm yourself gradually and go to bed | Your nervous system will favor deep sleep | Experience extremely restorative sleep"
Better Sleep,HIGH,6,Emotional Release Session,5 minutes,Express and release difficult emotions before sleep,"Find a private space and allow yourself to cry | Release pent-up emotions from the day | Scream or vocalize if needed | Don't suppress, let it all out | By the end, you feel emotionally cleansed | Go to bed feeling lighter | Sleep will be deeper and more restorative"
Better Sleep,HIGH,7,Sleep Deprivation Strategy,5 minutes,Strategic sleep timing for deep sleep (Use carefully),"Only sleep 5-6 hours the previous night | Stay awake all the following day | Wait until your normal bedtime | By the time you sleep, you'll be exhausted | Sleep will be immediate and extremely deep | WARNING: Only do this occasionally, not regularly | Use sparingly for powerful sleep recovery"
Better Sleep,HIGH,8,Intense Massage Session,5 minutes,Deep tissue work before bed for sleep,Use a massage gun on tight muscle areas | Or have someone give you a deep tissue massage | Release deeply held tension and trigger points | Work intensely for 5 minutes | This releases endorphins and relaxation | Your body will feel completely resolved | Sleep will be deep and continuous
Better Sleep,HIGH,9,Climactic Physical Challenge,5 minutes,Final intense movement session right before bed,"Do 5 minutes of maximum-intensity exercise | Stairs, sprints, or climbing movements | Push yourself to near complete exhaustion | The extreme physical demand triggers sleep | Your body desperately needs recovery | Immediately go to bed after | Experience knock-out, restorative sleep"
Better Sleep,HIGH,10,Crisis Release Work,5 minutes,Work through major stressors before sleep,Write or express major worries quickly | Get them out of your head | Make action plans for what needs to be done | Mentally release responsibility for tonight | Tell yourself you'll handle it tomorrow | Lie down with a clear conscience | Sleep will be deep as worries are processed
