Pillar,Energy Level,Challenge #,Challenge Name,Duration,Description,Steps
Better Sleep,HIGH,11,Extreme Sport Session,5 minutes,High-adrenaline activity for deep sleep,"Engage in intense sport: rock climbing, martial arts, etc. | Push yourself to high arousal levels | The extreme activation exhausts your system | As the adrenaline wears off, sleep becomes dominant | Your brain will desperately want rest | Go to bed within hours | Sleep will be profound and healing"
Better Sleep,HIGH,12,Controlled Hyperventilation,5 minutes,Intense breathing followed by deep relaxation (Use carefully),Breathe rapidly and deeply for 30 seconds | Your nervous system becomes activated | Suddenly stop and breathe normally | The rebound effect creates deep calm | Repeat this pattern 2-3 times | Each cycle deepens the parasympathetic response | WARNING: May cause lightheadedness | Sleep will be very deep
Better Sleep,HIGH,13,Intense Conflict Resolution,5 minutes,Deep emotional processing before sleep,"Have a meaningful conversation or journaling session | Work through a significant relationship issue | Feel the emotional intensity fully | By the end, feel emotionally resolved | Your psyche will seek sleep for integration | Sleep will be deep as your mind processes | Wake up with new clarity and integration"
Better Sleep,HIGH,14,Maximum Accountability Session,5 minutes,Mental work that exhausts the mind for sleep,Work through difficult decisions or problems | Make commitments and action plans | Take full accountability for your life | This mental work exhausts your prefrontal cortex | Your brain will demand rest | Sleep will be deep as your mind integrates | Wake up feeling resolved
Better Sleep,HIGH,15,Peak Experience Culmination,5 minutes,Highly emotional experience right before bed,Watch something extremely meaningful to you | Listen to emotionally powerful music | Read something that moves you deeply | Allow full emotional experience | The emotional release exhausts you | Go to bed in this emotionally processed state | Sleep will be profound and integrative
Physical Fitness,LOW,1,Gentle Walking,5 minutes,Easy low-impact cardio activity,"Find a comfortable walking space | Walk at a slow, comfortable pace | Focus on proper posture | Swing arms gently with each step | Maintain steady breathing | Walk for full 5 minutes | Cool down with slower pace at the end"
Physical Fitness,LOW,2,Seated Arm Raises,5 minutes,Upper body strengthening from seated position,"Sit upright in a sturdy chair | Raise both arms out to sides to shoulder height | Lower arms and repeat, 2 minutes | Raise arms forward to shoulder height | Lower and repeat, 2 minutes | Raise arms overhead | Lower and repeat, 1 minute"
Physical Fitness,LOW,3,Standing Hip Circles,5 minutes,Hip mobility and light core engagement,"Stand with feet hip-width apart | Place hands on hips | Make slow circles with your hips, 1.5 minutes clockwise | Reverse direction, 1.5 minutes counterclockwise | Increase the size of circles | Notice the loosening in your hips | End with small gentle circles"
Physical Fitness,LOW,4,Wall Push-Ups,5 minutes,Low-intensity chest and arm strengthening,"Face a wall at arm's length distance | Place hands on wall at shoulder height | Lean in toward wall, pushing back to start | Do 15-20 repetitions, rest 1 minute | Repeat for 2-3 more sets | Maintain proper form and steady breathing | Notice the mild chest and arm engagement"
Physical Fitness,LOW,5,Glute Bridges,5 minutes,Lower body activation and strengthening,"Lie on your back with knees bent, feet flat | Press through your heels and lift hips up | Hold for 2 seconds at the top | Lower and repeat, 3 minutes of continuous reps | Rest 1 minute | Do another 1 minute of continuous reps | Feel the glute activation"
Physical Fitness,LOW,6,Shoulder Rolls,5 minutes,Mobility and tension release,"Stand upright with arms at your sides | Roll shoulders backward slowly, 2 minutes (20 rolls) | Rest 30 seconds | Roll shoulders forward slowly, 2 minutes (20 rolls) | Rest 30 seconds | Notice improved shoulder mobility | Maintain relaxed posture"
Physical Fitness,LOW,7,Calf Raises,5 minutes,Lower leg strengthening,Stand with feet hip-width apart | Rise up onto your toes | Lower back down and repeat | Do this continuously for 3 minutes | Rest 1 minute | Continue for another 1 minute | Feel the calf muscle engagement
Physical Fitness,LOW,8,Gentle Yoga Stretch Flow,5 minutes,Flexibility and mobility work,"Child's pose, hold 45 seconds | Cat-cow stretch, 1 minute flowing | Downward dog, hold 45 seconds | Forward fold, hold 45 seconds | Repeat the sequence | Move slowly and deliberately | End in standing forward fold"
Physical Fitness,LOW,9,Bicep Curls with Light Weight,5 minutes,Arm strengthening with resistance,"Hold light dumbbells or water bottles | Curl weight toward shoulders, 45 seconds | Rest 15 seconds | Repeat curls, 45 seconds | Rest 15 seconds | Continue alternating for full 5 minutes | Focus on controlled movement"
Physical Fitness,LOW,10,Quadriceps Tightening,5 minutes,Isometric leg strengthening,"Sit in a chair with legs extended | Tighten your thigh muscles, hold for 5 seconds | Release and rest 5 seconds | Repeat this pattern continuously for 5 minutes | Alternate legs or do both simultaneously | The isometric work strengthens without movement | Notice the muscle engagement"
Physical Fitness,LOW,11,Seated Torso Twists,5 minutes,Core and rotational flexibility,"Sit upright in a chair | Cross arms over chest | Slowly twist torso to the right, hold 20 seconds | Return to center and twist left, hold 20 seconds | Repeat this pattern for 5 minutes | Increase the range gradually | Feel the core engagement and flexibility"
Physical Fitness,LOW,12,Hamstring Stretch,5 minutes,Posterior chain flexibility,"Stand or sit with legs extended | Reach toward your toes gently | Hold when you feel a stretch, 1 minute | Relax and reach further | Hold the deeper stretch, 1 minute | Repeat this 2-3 more times | End with relaxed gentle stretch"
Physical Fitness,LOW,13,Plank Hold (Modified),5 minutes,Core strengthening with modification,Assume plank position with knees on ground | Hold for 20-30 seconds | Rest 30 seconds | Repeat this pattern 5-6 times throughout 5 minutes | Maintain proper alignment | Feel core activation | Gradually increase hold time
Physical Fitness,LOW,14,Resistance Band Rows,5 minutes,Back strengthening with resistance,"Hold resistance band with both hands | Pull band toward your body, elbows back | Do this for 45 seconds | Rest 15 seconds | Repeat for 5 cycles | Focus on squeezing shoulder blades together | Notice back and shoulder engagement"
Physical Fitness,LOW,15,Lateral Leg Lifts,5 minutes,Hip and glute strengthening,"Stand on one leg, hold onto something for balance | Lift other leg out to the side slowly | Lower and repeat, 2 minutes each side | Rest 1 minute | Repeat for another minute on each side | Feel hip and glute activation | Maintain proper posture"
Physical Fitness,MEDIUM,1,Circuit Training Moderate,5 minutes,Back-to-back exercises at moderate intensity,Do 45 seconds of bodyweight squats | Do 45 seconds of push-ups | Do 45 seconds of lunges | Do 45 seconds of mountain climbers | Do 45 seconds of jumping jacks | Rest 1 minute | Repeat the circuit once
Physical Fitness,MEDIUM,2,Moderate Jogging,5 minutes,Steady-state cardio at moderate pace,Warm up with 1 minute of walking | Jog at comfortable but challenging pace for 3 minutes | Cool down with 1 minute of walking | Maintain steady breathing | Monitor your intensity (should be able to speak) | Notice heart rate elevation | Feel energized at the end
Physical Fitness,MEDIUM,3,Compound Lift Session,5 minutes,Major compound movements for strength,Do 1 minute of goblet squats (holding weight) | Do 1 minute of dumbbell rows | Do 1 minute of push-ups (regular or modified) | Do 1 minute of deadlifts or deadlift variations | Do final 1 minute of your strongest movement | Rest only as needed to maintain form | Feel full-body engagement
Physical Fitness,MEDIUM,4,Moderate Cycling,5 minutes,Stationary bike at moderate effort,Warm up for 1 minute at easy pace | Increase to moderate intensity for 3 minutes | Cool down for 1 minute at easy pace | Maintain cadence of 80-100 RPM | Increase resistance to increase difficulty | Focus on smooth pedaling | Notice leg engagement and cardio benefit
Physical Fitness,MEDIUM,5,Ab Circuit Moderate,5 minutes,Core strengthening with moderate intensity,Do 1 minute of crunches | Do 45 seconds of plank hold | Do 45 seconds of bicycle crunches | Do 45 seconds of leg raises | Do 45 seconds of dead bugs | Rest 30 seconds | Repeat the circuit
Physical Fitness,MEDIUM,6,Jump Rope Session,5 minutes,Moderate-paced jump rope work,"Warm up with easy jumping, 1 minute | Do moderate-paced jumping for 3 minutes | Cool down with easy jumping, 1 minute | Focus on steady rhythm | Keep core engaged | Notice improved coordination | Feel cardiovascular and lower body work"
Physical Fitness,MEDIUM,7,Bodyweight Strength Sequence,5 minutes,Progressive bodyweight movements,Do 1 minute of push-ups | Do 1 minute of squats | Do 1 minute of tricep dips (using chair) | Do 1 minute of lunges | Do final 1 minute combining movements | Maintain good form throughout | Feel muscle activation throughout body
Physical Fitness,MEDIUM,8,Interval Running,5 minutes,Alternating pace running,Warm up with 1 minute easy jogging | Do 30 seconds at moderate speed | Do 30 seconds at easy speed | Repeat the pattern 3 more times | Cool down with 1 minute easy pace | Focus on smooth transitions | Notice the cardiovascular benefit
Physical Fitness,MEDIUM,9,Kettlebell Swings,5 minutes,Dynamic full-body kettlebell work,"Hold kettlebell with both hands | Do 45 seconds of continuous swings | Rest 15 seconds | Repeat this pattern 5 times | Swing with hip power, not arm power | Maintain steady breathing | Feel full-body engagement"
Physical Fitness,MEDIUM,10,Swimming Moderate,5 minutes,Steady-pace swimming,Warm up with 1 minute of easy swimming | Swim at moderate pace for 3 minutes | Cool down with 1 minute of easy swimming | Use steady breathing rhythm | Alternate strokes if desired | Notice full-body engagement | Feel low-impact cardiovascular work
Physical Fitness,MEDIUM,11,Suspension Trainer Circuit,5 minutes,Full-body work with suspension trainer,Do 1 minute of rows | Do 1 minute of push-ups with suspension trainer | Do 1 minute of squats with suspension trainer | Do 1 minute of hamstring curls | Do final 1 minute combining movements | Maintain core engagement throughout | Feel total-body activation
Physical Fitness,MEDIUM,12,Stair Climbing,5 minutes,Lower body cardio on stairs,"Warm up walking stairs slowly, 1 minute | Climb stairs at moderate pace for 3 minutes | Cool down walking slowly for 1 minute | Maintain upright posture | Use handrail for balance if needed | Notice glute and leg engagement | Feel cardiovascular challenge"
Physical Fitness,MEDIUM,13,Dumbbell Thrusters,5 minutes,Full-body compound movement,Hold dumbbells at shoulder height | Do 1 minute of thrusters (squat then press) | Rest 30 seconds | Do another 1 minute of thrusters | Rest 30 seconds | Do final 1 minute at maximum effort | Feel full-body engagement and cardio work
Physical Fitness,MEDIUM,14,Battle Ropes,5 minutes,Upper body and core dynamic work,Hold battle ropes at waist height | Do 45 seconds of alternating arm waves | Rest 15 seconds | Do 45 seconds of simultaneous waves | Rest 15 seconds | Repeat pattern throughout 5 minutes | Feel upper body and core engagement
Physical Fitness,MEDIUM,15,Functional Movement Flow,5 minutes,Natural movement patterns at moderate intensity,"Do 1 minute of crawling movements | Do 1 minute of jumping movements | Do 1 minute of throwing movements | Do 1 minute of reaching movements | Do final 1 minute combining movements | Focus on natural, efficient movement | Feel functional full-body engagement"
Physical Fitness,HIGH,1,HIIT Maximum,5 minutes,High-intensity interval training at maximum effort,Do 40 seconds burpees at maximum intensity | Rest 20 seconds | Do 40 seconds jump squats at maximum intensity | Rest 20 seconds | Do 40 seconds mountain climbers at maximum intensity | Rest 20 seconds | Do final 40 seconds at absolute maximum
Physical Fitness,HIGH,2,Sprint Training,5 minutes,Maximum-speed running intervals,Warm up with 30 seconds easy jogging | Sprint 30 seconds at maximum speed | Recover 30 seconds with walk/jog | Repeat sprint-recovery pattern 4 more times | Cool down with 30 seconds easy pace | Push to maximum effort on each sprint | Feel full cardiovascular challenge
Physical Fitness,HIGH,3,Maximum Strength Circuit,5 minutes,Heavy compound lifts back-to-back,Do 1 minute of heavy squats (or max effort equivalent) | Do 1 minute of heavy deadlifts | Do 1 minute of heavy bench press or push-ups | Do 1 minute of heavy rows | Do final 1 minute at maximum effort on strongest lift | Use maximum sustainable weight | Rest only when form breaks
Physical Fitness,HIGH,4,CrossFit-Style Workout,5 minutes,Complex movements at high intensity,Do 1 minute of kettlebell snatches (alternating) | Do 1 minute of box jumps or burpee box jumps | Do 1 minute of medicine ball slams | Do 1 minute of rope climbs or equivalent | Do final 1 minute combining movements | Go at maximum sustainable pace | Feel total-body extreme challenge
Physical Fitness,HIGH,5,Plyometric Explosion,5 minutes,Maximum explosive movements,Do 1 minute of clapping push-ups at maximum pace | Do 1 minute of broad jumps (or maximum jump equivalents) | Do 1 minute of explosive lunges | Do 1 minute of bounding movements | Do final 1 minute at absolute maximum intensity | Explode with every movement | Feel explosive power development
Physical Fitness,HIGH,6,Extreme Cardio Blast,5 minutes,Maximum cardiovascular challenge,"Choose your most challenging cardio activity | Push at maximum intensity for full 5 minutes | Examples: rowing, cycling, running, swimming | Go 'all out' without stopping | Focus only on maximum effort | Your heart rate should be maximal | End completely exhausted"
Physical Fitness,HIGH,7,Combat Sport Drill,5 minutes,Maximum-intensity martial arts,1 minute of maximum-speed punching combinations | 1 minute of maximum-speed kicking combinations | 1 minute of shadow boxing at maximum intensity | 1 minute of mitt work or bag work at maximum power | 1 minute combining all movements at maximum | Deliver maximum power and speed | Feel warrior energy and power
Physical Fitness,HIGH,8,Total Body Power Day,5 minutes,Complex full-body movements,1 minute of dumbbell snatches at maximum intensity | 1 minute of heavy cleans or alternatives | 1 minute of Turkish get-ups at maximum pace | 1 minute of farmer's carries with heavy weight | 1 minute combining movements at maximum | Use maximum manageable weight | Go to near-failure on each exercise
Physical Fitness,HIGH,9,Extreme Core Challenge,5 minutes,Maximum-intensity core work,1 minute of full plank holds to failure | 1 minute of ab wheel rollouts or maximum equivalent | 1 minute of weighted sit-ups at maximum pace | 1 minute of V-ups or maximum equivalent | 1 minute combining all at maximum intensity | Push abs to complete fatigue | Feel extreme core engagement
Physical Fitness,HIGH,10,Obstacle Course Sprint,5 minutes,Maximum-intensity obstacle navigation,Set up or find an obstacle course | Run through at maximum speed for full 5 minutes | Complete as many rounds as possible | Push intensity to maximum | Use full power and speed | Challenge your agility and power | Feel complete physical exhaustion
Physical Fitness,HIGH,11,Maximum Endurance Test,5 minutes,Longest sustainable maximum effort,"Choose 1-2 compound movements | Do them continuously at maximum sustainable pace | Examples: kettlebell swings, burpees, or jump rope | Continue for full 5 minutes without stopping | Never drop below maximum effort level | Complete as many reps as possible | Feel total exhaustion at the end"
Physical Fitness,HIGH,12,Team Competitive Sport,5 minutes,Full-intensity competitive team sport,"Play your favorite sport at maximum competitive level | Examples: basketball, soccer, rugby, hockey | Go 100% for the entire 5 minutes | Use maximum effort and intensity | Engage fully with strategy and power | Feed off competitive energy | Feel extreme physical challenge"
Physical Fitness,HIGH,13,Extreme Strength Endurance,5 minutes,Heavy weight for high reps,"Use weights at 60-70% of maximum strength | Do high reps continuously for 5 minutes | Rotate between major movement patterns | Maintain intensity throughout | Never rest, keep moving | Burn out every muscle group | Feel complete metabolic challenge"
Physical Fitness,HIGH,14,Olympic Lift Complex,5 minutes,Complex Olympic lifting variations,1 minute of clean and jerk repetitions | 1 minute of snatch variations at maximum power | 1 minute of complex combinations | 1 minute of heavy compound movements | 1 minute at absolute maximum intensity | Use maximum sustainable weight | Feel explosive power and total fatigue
Physical Fitness,HIGH,15,Final Victory Sprint,5 minutes,Absolute maximum final effort,"Give yourself 5 full minutes | Do your most challenging and favorite movement | Push to absolute maximum every single second | No rest, no stopping, pure effort | Go until you cannot continue | Finish strong with remaining energy | Celebrate the extreme effort"
Healthy Eating,LOW,1,Mindful Snack Pause,5 minutes,Conscious eating of a healthy snack,"Choose a healthy snack (apple, nuts, yogurt, etc.) | Sit comfortably and avoid distractions | Observe the food: color, shape, texture | Smell the food deeply | Eat one piece slowly, chewing thoroughly | Notice the taste and texture fully | Finish the snack with full awareness"
Healthy Eating,LOW,2,Hydration Ritual,5 minutes,Intentional water drinking,"Fill a glass with fresh water | Sit in a comfortable spot | Hold the glass and notice its coolness | Take slow, deliberate sips | Drink half the glass slowly over 5 minutes | Notice the refreshing sensation | Appreciate the hydration benefit"
Healthy Eating,LOW,3,Vegetable Appreciation,5 minutes,Learning to enjoy vegetables,"Choose a vegetable (carrot, cucumber, bell pepper) | Cut it into bite-sized pieces | Observe the natural colors and patterns | Smell each piece | Eat slowly, chewing thoroughly | Notice the natural flavors | Appreciate vegetables' health benefits"
Healthy Eating,LOW,4,Healthy Smoothie Preparation,5 minutes,Making a nutritious smoothie,"Gather ingredients: fruit, yogurt, liquid, optional greens | Add ingredients to blender intentionally | Blend until smooth | Pour into a glass slowly | Observe the color and consistency | Drink slowly, enjoying each sip | Notice the energy from nutrients"
Healthy Eating,LOW,5,Fruit Salad Creation,5 minutes,Preparing a colorful fruit mix,"Choose 3-4 different fruits | Wash fruits carefully | Cut into bite-sized pieces | Arrange colorfully on a plate | Eat slowly, one piece at a time | Notice different flavors of each fruit | Enjoy the natural sweetness and nutrition"
Healthy Eating,LOW,6,Protein Source Appreciation,5 minutes,Mindfully consuming protein,"Choose a protein: egg, fish, tofu, beans, etc. | Prepare simply without rushing | Plate it nicely | Sit and focus on eating | Chew thoroughly, notice protein benefit | Eat slowly for full 5 minutes | Feel satisfied and nourished"
Healthy Eating,LOW,7,Whole Grain Introduction,5 minutes,Learning to enjoy whole grains,"Prepare a whole grain: brown rice, oats, quinoa | Plate a small portion | Observe the texture and color | Eat slowly and deliberately | Notice the nutty flavor | Feel the sustained energy from whole grains | Appreciate nutritional density"
Healthy Eating,LOW,8,Herbal Tea Ritual,5 minutes,Calming tea with mindfulness,"Brew your favorite herbal tea | Hold the warm cup | Breathe in the steam | Smell the tea deeply | Sip slowly, noticing the taste | Feel the warmth spreading | Finish the tea with full presence"
Healthy Eating,LOW,9,Nut Portion Control,5 minutes,Eating nuts mindfully and in moderation,"Measure a small handful of nuts | Sit comfortably away from distractions | Eat one nut at a time | Chew thoroughly, notice the flavor | Feel the healthy fat satisfaction | Eat slowly for full 5 minutes | Feel satisfied with small portion"
Healthy Eating,LOW,10,Dark Chocolate Appreciation,5 minutes,Enjoying dark chocolate mindfully,Choose high-quality dark chocolate | Break into small squares | Observe the color and texture | Smell the chocolate | Place one piece in mouth and let it melt | Notice the rich flavor | Enjoy small amounts with full presence
Healthy Eating,LOW,11,Healthy Oil Tasting,5 minutes,Learning about healthy fats,Taste a small amount of olive oil | Notice the flavor and aroma | Consider how to use it in cooking | Learn about heart-health benefits | Appreciate quality oils | Plan to incorporate into meals | Feel empowered about nutrition
Healthy Eating,LOW,12,Spice Appreciation,5 minutes,Exploring healthy flavor additives,"Choose a healing spice: turmeric, ginger, cinnamon | Smell the spice deeply | Research its health benefits | Add to a simple dish or tea | Taste and appreciate the flavor | Notice the flavor enhancement | Plan to use spices regularly"
Healthy Eating,LOW,13,Leftover Meal Appreciation,5 minutes,Enjoying prepared healthy meals,Reheat a healthy meal prepared earlier | Plate it nicely | Sit and eat without distraction | Appreciate the planning and preparation | Notice the flavors and nutrition | Eat slowly and mindfully | Feel satisfied and nourished
Healthy Eating,LOW,14,Superfood Smoothie Bowl,5 minutes,Creating a nutrient-dense bowl,"Make a thick smoothie base | Add nutritious toppings: granola, seeds, berries | Arrange beautifully | Eat with a spoon slowly | Notice each ingredient's nutrition | Enjoy the variety of textures | Feel the energy boost from nutrients"
Healthy Eating,LOW,15,Gratitude Meal Moment,5 minutes,Expressing gratitude for healthy food,Prepare any healthy meal or snack | Sit and pause before eating | Express gratitude for the food | Acknowledge the energy and nutrition it provides | Eat slowly and intentionally | Feel appreciation with each bite | Complete the meal with full gratitude
Healthy Eating,MEDIUM,1,Healthy Meal Preparation,5 minutes,Quick prep of a balanced meal,"Choose a balanced meal: protein + vegetable + grain | Prep ingredients: wash, cut, portion | Combine into a balanced plate | Cook or assemble quickly | Plate attractively | Eat seated with focus for full 5 minutes | Feel satisfied and nourished"
Healthy Eating,MEDIUM,2,Vegetable Cooking Skill,5 minutes,Learning to cook vegetables well,"Choose a vegetable to cook | Prepare (wash, cut) | Saut or roast quickly with healthy oil | Add simple seasonings | Plate when cooked | Taste and adjust seasoning | Learn cooking techniques for better taste"
Healthy Eating,MEDIUM,3,Meal Prep Planning,5 minutes,Planning healthy meals for the week,Review your weekly schedule | Plan 3-5 simple healthy meals | Make a shopping list | Consider variety and nutrition | Write down meal plan details | Note any prep needed | Feel prepared and organized
Healthy Eating,MEDIUM,4,Protein Cooking Basics,5 minutes,Learning to cook protein sources,"Choose protein: fish, chicken, beans, tofu | Prepare properly for cooking | Cook using healthy method: grill, bake, steam | Season with herbs and spices | Test for doneness appropriately | Plate and eat slowly | Learn to cook proteins well"
Healthy Eating,MEDIUM,5,Balanced Plate Assembly,5 minutes,Creating nutritionally balanced meals,"Select portion of protein | Add generous serving of vegetables | Add whole grain portion | Add healthy fat source (oil, nuts, etc.) | Arrange into appealing plate | Eat slowly and intentionally | Feel complete nutrition"
Healthy Eating,MEDIUM,6,Salad Creation Art,5 minutes,Making delicious healthy salads,"Choose lettuce or greens base | Add colorful vegetables | Add protein: beans, fish, chicken, nuts | Prepare simple vinaigrette | Toss just before eating | Eat slowly and enjoy | Learn to make salads satisfying"
Healthy Eating,MEDIUM,7,Soup Preparation,5 minutes,Quick healthy soup making,"Choose broth and vegetables | Quickly prep and chop vegetables | Simmer in broth with seasonings | Add protein if desired | Simmer until cooked through | Taste and adjust seasoning | Enjoy warm, nourishing soup"
Healthy Eating,MEDIUM,8,Snack Strategy Planning,5 minutes,Planning healthy snack options,Identify healthy snack options you enjoy | Plan snacks for the week | Purchase or prepare snacks in advance | Portion into convenient containers | Make them easily accessible | Prepare 1-2 snacks to have ready | Feel equipped for healthy snacking
Healthy Eating,MEDIUM,9,Recipe Discovery,5 minutes,Finding new healthy recipes,Browse healthy recipe websites or books | Find 1-2 recipes that appeal to you | Read through ingredients and instructions | Consider nutrition and ingredients | Make shopping list if needed | Plan to try one soon | Expand your healthy cooking repertoire
Healthy Eating,MEDIUM,10,Beverage Swap Planning,5 minutes,Replacing unhealthy drinks with healthy options,Identify unhealthy beverages in your diet | Research healthy alternatives | Choose healthier options you'll enjoy | Purchase healthy beverages | Create transition plan for swaps | Start replacing 1-2 drinks | Feel proud of beverage improvements
Healthy Eating,MEDIUM,11,Healthy Breakfast Ideas,5 minutes,Planning nutritious breakfast options,Think of breakfast that appeals to you | Ensure it includes protein and whole grains | Prepare one breakfast to eat | Eat slowly and mindfully | Plan other breakfast options for week | Gather ingredients as needed | Commit to nutritious breakfasts
