Pillar,Energy Level,Challenge #,Challenge Name,Duration,Description,Steps
Healthy Eating,MEDIUM,12,Lunch Prep Session,5 minutes,Quick lunch preparation for upcoming days,Choose 1-2 lunch ideas | Prep components quickly | Assemble containers with portions | Label with date if needed | Store properly | Taste one to ensure quality | Feel ready for healthy lunches
Healthy Eating,MEDIUM,13,Nutrition Label Learning,5 minutes,Understanding nutrition information,"Pick a packaged food item | Study the nutrition label | Identify serving size | Check calories, protein, fiber | Compare to other similar products | Make informed purchasing decisions | Feel educated about nutrition"
Healthy Eating,MEDIUM,14,Dessert Alternatives,5 minutes,Finding healthier sweet treats,Identify your dessert cravings | Research healthier alternatives | Try one healthier option | Enjoy slowly and mindfully | Evaluate if it satisfies | Plan healthier dessert options | Reduce unhealthy dessert intake
Healthy Eating,MEDIUM,15,Cooking Technique Practice,5 minutes,Learning healthy cooking methods,"Choose a cooking technique: grill, steam, bake | Prepare simple ingredients | Practice the technique | Cook and taste the results | Note what worked well | Plan to use this technique regularly | Expand healthy cooking skills"
Healthy Eating,HIGH,1,Complete Meal from Scratch,5 minutes,Preparing complex multi-component meal quickly,Choose a complex healthy recipe | Prep all ingredients simultaneously | Work efficiently through multiple cooking steps | Manage timing of different components | Plate beautifully and present | Eat slowly despite effort | Appreciate culinary creation
Healthy Eating,HIGH,2,Intensive Meal Prep Day,5 minutes,Quick efficient prep for entire week,Plan 5-7 complete meals quickly | Create master shopping list | Prep proteins efficiently | Prep vegetables in large batches | Portion into containers rapidly | Organize storage optimally | Feel extremely prepared
Healthy Eating,HIGH,3,Advanced Recipe Execution,5 minutes,Preparing sophisticated healthy recipe,Choose advanced recipe with multiple steps | Execute precisely and efficiently | Manage complex techniques simultaneously | Control timing perfectly | Plate professionally | Taste and refine | Impress with culinary skill
Healthy Eating,HIGH,4,Nutritional Optimization Analysis,5 minutes,Deep analysis of nutritional needs,Assess your personal nutrition goals | Calculate your macronutrient needs | Research optimal micronutrient ratios | Design personalized nutrition strategy | Create meal plan aligned with goals | Prepare to implement thoroughly | Commit to nutritional excellence
Healthy Eating,HIGH,5,Specialty Ingredient Exploration,5 minutes,Discovering and using advanced ingredients,Research exotic superfoods | Purchase specialty healthy ingredients | Learn proper preparation methods | Incorporate into sophisticated recipes | Taste and appreciate | Expand nutritional variety significantly | Feel advanced in healthy eating
Healthy Eating,HIGH,6,Dietary Challenge Week,5 minutes,Planning week of nutritional improvement,"Choose nutritional challenge for week | Examples: all organic, plant-based, grain-free | Plan 7 compliant meals | Research all required ingredients | Make comprehensive shopping list | Prepare to execute perfectly | Commit to week-long discipline"
Healthy Eating,HIGH,7,Elimination Diet Planning,5 minutes,Strategic elimination to identify sensitivities,"Choose food groups to eliminate (e.g., dairy) | Research elimination diet protocol | Plan compliant meals for elimination period | Create detailed food journal plan | Gather replacement ingredients | Prepare for strict adherence | Commit to nutrition experiment"
Healthy Eating,HIGH,8,Advanced Cooking Class,5 minutes,Learning advanced healthy cooking techniques,Choose advanced technique to master | Study technique in depth | Practice with focus and precision | Critique your execution | Refine technique based on results | Plan regular practice | Master advanced culinary skills
Healthy Eating,HIGH,9,Nutritionist Consultation Planning,5 minutes,Preparing for professional nutrition guidance,Document current eating habits | List health goals and concerns | Research potential nutritionists | Prepare detailed food diary | Write specific questions | Schedule consultation | Prepare for expert guidance
Healthy Eating,HIGH,10,Organic & Local Sourcing,5 minutes,Finding and supporting local/organic sources,Research local farmers markets | Find organic suppliers | Visit sources in person | Build relationships with growers | Plan seasonal purchases | Commit to sustainable sourcing | Feel deeply connected to food sources
Healthy Eating,HIGH,11,Gut Health Optimization,5 minutes,Strategic nutrition for digestive health,Research gut health principles | Identify foods for optimal digestion | Plan meals supporting gut bacteria | Include fermented foods strategically | Prepare comprehensive food plan | Track digestive improvements | Optimize gastrointestinal health
Healthy Eating,HIGH,12,Anti-Inflammatory Mastery,5 minutes,Designing anti-inflammatory nutrition strategy,Learn anti-inflammatory foods deeply | Identify pro-inflammatory foods to eliminate | Create comprehensive anti-inflammatory meal plan | Research optimal timing and combinations | Implement systematically | Track inflammation markers improvement | Master inflammation management through food
Healthy Eating,HIGH,13,Performance Nutrition Planning,5 minutes,Nutrition optimized for athletic performance,Assess performance goals | Calculate optimal macronutrient ratios | Research performance-enhancing foods | Plan pre/post-workout nutrition | Time meals for maximum benefit | Prepare scientifically-based nutrition | Optimize athletic performance through food
Healthy Eating,HIGH,14,Advanced Meal Prep Engineering,5 minutes,Sophisticated meal prep system design,Design month-long meal prep schedule | Create recipes that maximize variety | Design efficient batch-cooking process | Optimize storage and organization | Plan rotation to prevent boredom | Implement system | Achieve nutritional perfection
Healthy Eating,HIGH,15,Genetic Nutrition Optimization,5 minutes,Personalizing nutrition based on genetics,Research nutrigenomics basics | Consider genetic testing if available | Assess personal genetic predispositions | Design nutrition aligned with genetics | Optimize macro/micronutrient ratios | Implement personalized strategy | Achieve ultimate nutritional optimization
Social Connection,LOW,1,Gratitude Message,5 minutes,Send appreciation message to someone,"Think of someone who has helped you | Compose a genuine gratitude message | Be specific about what they did | Express how it made you feel | Send via text, email, or call | Wait for and enjoy their response | Feel the connection strengthen"
Social Connection,LOW,2,Photo Share Memory,5 minutes,Share a positive memory with someone,Find a photo of a happy memory | Message someone in the photo | Reminisce about the moment together | Share why it was meaningful | Enjoy the conversation | Notice the reconnection | Feel warmth of the shared memory
Social Connection,LOW,3,Social Media Connection,5 minutes,Engage meaningfully on social media,"Open social media platform | Find friend's recent post | Write thoughtful, genuine comment | Ask a real question or share relevant thought | Respond if they reply | Spend time in real engagement | Feel connected despite distance"
Social Connection,LOW,4,Call a Friend,5 minutes,Direct phone connection with someone,Choose someone you haven't talked to recently | Call them directly | Ask how they're doing | Really listen to their response | Share something about your life | Enjoy the conversation | End on a warm note
Social Connection,LOW,5,Online Community Participation,5 minutes,Join online discussion meaningfully,Find online community aligned with interests | Read recent discussions | Contribute thoughtfully to conversation | Ask genuine questions | Respond to others' replies | Notice the sense of belonging | Plan to participate regularly
Social Connection,LOW,6,Letter or Email Writing,5 minutes,Write personal message to distant friend,"Choose someone you miss | Write a genuine, heartfelt letter/email | Share updates and feelings | Ask about their life | Express that you're thinking of them | Send with intention | Feel the effort of connection"
Social Connection,LOW,7,Video Call Setup,5 minutes,Schedule and start video call,Arrange time with someone for video call | Set up device and good lighting | Find quiet comfortable space | Start call and see their face | Have genuine conversation | Make eye contact and be present | End with warm goodbye
Social Connection,LOW,8,Group Chat Engagement,5 minutes,Participate in group conversation,Check existing group chat | Read recent messages | Contribute something relevant or funny | Respond to others' messages | Keep conversation going | Notice the group dynamic | Feel part of the community
Social Connection,LOW,9,Birthday or Anniversary Acknowledgment,5 minutes,Recognize important day for someone,"Remember or check calendar for someone's special day | Send thoughtful birthday/anniversary message | Share a memory or why they matter | Send along with something (gift, photo, etc.) | Make them feel celebrated | Stay in touch after the day | Strengthen the relationship"
Social Connection,LOW,10,Hobby Sharing Discussion,5 minutes,Connect over shared interests,Think of shared hobby with someone | Reach out about it | Share something new you learned | Ask them about their recent experience | Discuss techniques or experiences | Make plans to do hobby together soon | Feel connection through shared interest
Social Connection,LOW,11,Problem Sharing Check-In,5 minutes,Vulnerability and support connection,Reach out to trusted friend | Share something you're struggling with | Be honest about your feelings | Listen to their thoughts | Allow them to support you | Feel the safety in vulnerability | Deepen the relationship
Social Connection,LOW,12,Compliment Delivery,5 minutes,Give genuine compliments to others,"Think of people in your life | Identify specific qualities you admire | Contact each person | Share sincere, detailed compliments | Explain why you appreciate them | Notice their positive response | Strengthen relationships through appreciation"
Social Connection,LOW,13,Invite to Activity,5 minutes,Suggest doing something together,Think of friend you miss | Consider activity you could do together | Reach out with specific invitation | Suggest date and time | Make it easy for them to say yes | Feel excited about spending time | Plan follow-up if they can't make it
Social Connection,LOW,14,Story or Article Sharing,5 minutes,Share interesting content with others,"Find article, video, or story | Think of who would enjoy it | Send with personal note | Explain why you thought of them | Discuss when they respond | Feel the casual connection | Make sharing a regular practice"
Social Connection,LOW,15,Supportive Comment,5 minutes,Show support during someone's challenge,Notice if someone is going through difficulty | Reach out with supportive message | Validate their feelings | Offer specific support if appropriate | Let them know you're thinking of them | Check in later | Be the friend you'd want
Social Connection,MEDIUM,1,Lunch or Coffee Date,5 minutes,Plan and initiate in-person meetup,Choose friend or person to meet | Suggest specific coffee shop or restaurant | Propose specific date and time | Confirm and discuss what to bring | Arrive early and prepare space | Greet warmly and engage fully | End with concrete plans to meet again
Social Connection,MEDIUM,2,Group Activity Organization,5 minutes,Coordinate group outing or event,"Think of activity multiple people would enjoy | Identify interested people | Message group with specific proposal | Handle logistics (time, place, cost) | Send reminders as date approaches | Lead the activity with energy | Make it memorable"
Social Connection,MEDIUM,3,Skill Sharing Session,5 minutes,Teach someone a skill you have,Identify skill someone wants to learn | Prepare simple lesson plan | Schedule teaching session | Teach patiently and encouragingly | Let them practice with your guidance | Celebrate their progress | Offer future sessions
Social Connection,MEDIUM,4,Dinner Party Planning,5 minutes,Host dinner bringing friends together,Decide on date and guest list | Invite people with specific invitation | Plan menu and prepare ahead | Set welcoming atmosphere | Cook and serve with care | Facilitate conversation and connection | Make guests feel valued and welcomed
Social Connection,MEDIUM,5,Activity Partner Find,5 minutes,Recruit partner for regular activity,"Identify activity you enjoy | Find person interested in joining | Propose making it regular (weekly, monthly) | Establish consistent schedule | Share the activity together | Enjoy the routine connection | Deepen friendship through shared activity"
Social Connection,MEDIUM,6,Event Attendance,5 minutes,Attend community or social event,Find event aligned with interests | Invite friend or go alone | Arrive and introduce yourself to people | Engage in conversations | Join activities or discussions | Exchange contact info with connections | Follow up with new connections
Social Connection,MEDIUM,7,Volunteer Together,5 minutes,Coordinate volunteer activity with others,Find cause you're passionate about | Invite friends to volunteer with you | Register and arrange logistics | Work together toward meaningful goal | Discuss impact during and after | Plan future volunteer activities | Feel purpose and connection together
Social Connection,MEDIUM,8,Travel Planning Buddy,5 minutes,Plan trip with friend or group,Decide on destination and timeframe | Invite interested people | Collaborate on planning | Book accommodations together | Plan activities and experiences | Discuss expectations | Create exciting shared experience
Social Connection,MEDIUM,9,Workshop or Class Together,5 minutes,Take learning experience with others,"Find class or workshop (dance, art, cooking, etc.) | Invite friends to join | Register together | Attend and participate actively | Practice together outside class | Progress and learn together | Share growth and experience"
Social Connection,MEDIUM,10,Mentor Relationship,5 minutes,Develop mentoring relationship,Identify someone you could mentor | Propose mentoring relationship | Establish regular meeting time | Share knowledge and experience | Provide guidance and support | Celebrate their progress | Build meaningful developmental relationship
Social Connection,MEDIUM,11,Support Group Participation,5 minutes,Join support group for shared experience,Find support group aligned with your needs | Attend meeting with open mind | Share authentically if comfortable | Listen to others' experiences | Find common ground with others | Return to future meetings | Feel supported by others with similar experiences
Social Connection,MEDIUM,12,Family Connection Time,5 minutes,Quality time with family members,Plan family activity everyone enjoys | Suggest date and get buy-in | Put phones away and be present | Engage in conversation and activities | Share stories and laughter | Create new memories together | Strengthen family bonds
Social Connection,MEDIUM,13,Collaborative Project,5 minutes,Work on project together with others,Identify project with friends | Divide responsibilities clearly | Collaborate and support each other | Communicate regularly | Celebrate progress milestones | Complete project together | Enjoy accomplishment as team
Social Connection,MEDIUM,14,Neighborhood Community Building,5 minutes,Connect with and support neighbors,Introduce yourself to neighbors | Propose neighborhood gathering or activity | Organize pot luck or event | Facilitate neighbor connections | Establish regular community meetings | Create supportive neighborhood culture | Build sense of community
Social Connection,MEDIUM,15,Accountability Partnership,5 minutes,Create supportive accountability with friend,Find friend with similar goals | Define shared goals clearly | Establish regular check-in schedule | Share progress and challenges | Support and encourage each other | Celebrate wins together | Stay motivated through partnership
Social Connection,HIGH,1,Large Group Event Organization,5 minutes,Organize event bringing many people together,Conceptualize event for 15+ people | Secure venue and handle logistics | Send comprehensive invitations | Manage RSVPs and follow-ups | Coordinate volunteers and setup | Lead event with energy and inclusivity | Facilitate meaningful connections
Social Connection,HIGH,2,Community Leadership Initiative,5 minutes,Start new community group or initiative,Identify community need or opportunity | Define mission and vision clearly | Recruit core team members | Establish structure and communication | Launch first official meeting | Delegate roles and responsibilities | Build sustainable community organization
Social Connection,HIGH,3,Intensive Mentoring Program,5 minutes,Develop formal mentoring program,Design comprehensive mentoring curriculum | Recruit mentees and mentors | Create matching system | Establish regular meeting schedule | Facilitate meaningful mentor-mentee relationships | Track progress and outcomes | Expand program impact
Social Connection,HIGH,4,Deep Vulnerability Session,5 minutes,Facilitate intense emotional connection group,"Organize small group of trusted people | Create safe, confidential space | Establish circle format | Facilitate deep sharing and listening | Allow authentic emotional expression | Support vulnerability | Create transformative bonding experience"
Social Connection,HIGH,5,Intensive Weekend Retreat,5 minutes,Organize multi-day retreat experience,Plan retreat concept and location | Invite committed participants | Arrange accommodations and meals | Design meaningful programming | Lead retreat activities and connections | Facilitate bonding and growth | Create life-changing experience
Social Connection,HIGH,6,Crisis Support Network,5 minutes,Establish network for members' emergencies,Identify core group members | Establish emergency communication system | Create crisis response protocol | Assign support roles | Practice responding to hypothetical crisis | Build deep trust and readiness | Ensure community can support in crisis
Social Connection,HIGH,7,International Connection Project,5 minutes,Build cross-cultural connections,Establish partnership with international group | Coordinate exchange program | Facilitate cultural learning | Organize ongoing communication | Plan in-person exchange if possible | Build bridges across cultures | Create global community
Social Connection,HIGH,8,Social Cause Campaign,5 minutes,Lead social justice or cause-driven effort,Identify cause you're passionate about | Build coalition of supporters | Develop campaign strategy | Organize events and outreach | Rally community support | Coordinate action toward goal | Create meaningful social impact
Social Connection,HIGH,9,Peer Support Training Program,5 minutes,Train others to provide peer support,Design peer support training curriculum | Recruit trainer candidates | Deliver comprehensive training | Certify peer support providers | Establish peer support network | Oversee peer support interactions | Scale mental health support through peers
Social Connection,HIGH,10,Family or Clan Reunion,5 minutes,Organize large-scale family gathering,Coordinate with extended family | Choose location and date | Arrange accommodations and activities | Create agenda with group activities | Facilitate reconnection and bonding | Document memories | Establish ongoing connection plans
Social Connection,HIGH,11,Networking Summit Organization,5 minutes,Organize professional networking event,Define summit theme and goals | Recruit high-value speakers | Secure venue for 50-100+ attendees | Develop program with panels and discussions | Facilitate meaningful professional connections | Follow up with attendees | Build reputation as connector and leader
Social Connection,HIGH,12,Deep Friendship Covenant,5 minutes,Create formal commitment with close friends,Gather closest friends | Discuss and articulate shared values | Create friendship covenant or manifesto | Define commitment to each other | Establish regular connection rituals | Make symbolic commitment | Build unshakeable bond
Social Connection,HIGH,13,Neighborhood Transformation Project,5 minutes,Lead community improvement initiative,Identify neighborhood improvement opportunity | Rally neighbors to contribute | Organize work parties and efforts | Secure funding or resources | Execute transformation project | Build neighborhood pride | Create lasting positive change
Social Connection,HIGH,14,Unconditional Support Pledge,5 minutes,Make deep commitment to someone's wellbeing,Choose person to deeply support | Have honest conversation about commitment | Define what support means | Establish regular check-ins | Show up consistently | Support through challenges | Create life-altering supportive relationship
Social Connection,HIGH,15,Generational Wisdom Sharing,5 minutes,Share life wisdom across generations,Organize gathering across age groups | Facilitate elder wisdom sharing | Record stories and lessons | Create intergenerational mentoring | Build continuity and learning | Create family or community legacy | Honor wisdom and experience
